<?xml version="1.0" encoding="UTF-8"?>
<pizzazo
xmlns:xsi="http://www.w3.org/2001/XMLSchema-instance"
xsi:schemaLocation="http://iit.uni-miskolc.hu XMLSchemaFE019W.xsd">
	<megrendelo mkod="1">
		<nev>Ehes Elemer</nev>
		<telefonszam>301111111</telefonszam>
		<lakcim>
			<iranyitoszam>2500</iranyitoszam>
			<varos>Kisfalva</varos>
			<utca>Kis utca</utca>
			<hazszam>6</hazszam>
		</lakcim>
	</megrendelo>
	<megrendelo mkod="2">
		<nev>Kajas Andras</nev>
		<telefonszam>302222222</telefonszam>
		<lakcim>
			<iranyitoszam>2600</iranyitoszam>
			<varos>Kozepesfalva</varos>
			<utca>Kozepes utca</utca>
			<hazszam>24</hazszam>
		</lakcim>
	</megrendelo>
	<megrendelo mkod="3">
		<nev>Husos Hugo</nev>
		<telefonszam>706666666</telefonszam>
		<lakcim>
			<iranyitoszam>2700</iranyitoszam>
			<varos>Nagyfalva</varos>
			<utca>Nagy utca</utca>
			<hazszam>8</hazszam>
		</lakcim>
	</megrendelo>
	<futar fkod="1">
		<telefonszam>205555555</telefonszam>
		<nev>Sebes Soma</nev>
		<eletkor>20</eletkor>
		<robogoTipus>Babetta</robogoTipus>
	</futar>
	<futar fkod="2">
		<telefonszam>308888888</telefonszam>
		<nev>Gyors Gyula</nev>
		<eletkor>22</eletkor>
		<robogoTipus>Simson</robogoTipus>
	</futar>
	<pizza pkod="1">
		<fajta>Margherita</fajta>
		<meret>20</meret>
		<ar>2000</ar>
	</pizza>
	<pizza pkod="2">
		<fajta>Magyaros</fajta>
		<meret>30</meret>
		<ar>3000</ar>
	</pizza>
	<pizza pkod="3">
		<fajta>Bolognese</fajta>
		<meret>25</meret>
		<ar>2500</ar>
	</pizza>
	<pizza pkod="4">
		<fajta>Prosciutto</fajta>
		<meret>20</meret>
		<ar>2800</ar>
	</pizza>
	<szakacs szkod="1">
		<nev></nev>
		<eletkor></eletkor>
		<kepesites></kepesites>
	</szakacs>
	<szakacs szkod="2">
		<nev>Sütő Samu</nev>
		<eletkor>30</eletkor>
		<kepesites>szakács</kepesites>
	</szakacs>
	<belepokartya bkod="1">
		<azonosito>24953</azonosito>
		<kiadasEve>2020</kiadasEve>
		<lejaratEve>2025</lejaratEve>
	</belepokartya>
	<belepokartya bkod="2">
		<azonosito>67159</azonosito>
		<kiadasEve>2019</kiadasEve>
		<lejaratEve>2024</lejaratEve>
	</belepokartya>
	<osszetevo okod="1">
		<elelmiszer>
			<nev>BL 55</nev>
			<tipus>gabona</tipus>
			<tomeg>1000</tomeg>	
			<lejarat>2022.02.16</lejarat>
		</elelmiszer>
	</osszetevo>
	<osszetevo okod="2">
		<elelmiszer>
			<nev>csirkemell</nev>
			<tipus>hús</tipus>
			<tomeg>300</tomeg>	
			<lejarat>2021.12.09</lejarat>
		</elelmiszer>
	</osszetevo>
	<osszetevo okod="3">
		<elelmiszer>
			<nev>paprika</nev>
			<tipus>zöldség</tipus>
			<tomeg>100</tomeg>	
			<lejarat>2021.12.19</lejarat>
		</elelmiszer>
	</osszetevo>
	<osszetevo okod="4">
		<elelmiszer>
			<nev>kukorica</nev>
			<tipus>gabona</tipus>
			<tomeg>200</tomeg>	
			<lejarat>2022.03.26</lejarat>
		</elelmiszer>
	</osszetevo>
	<osszetevo okod="5">
		<elelmiszer>
			<nev>darálthús</nev>
			<tipus>hús</tipus>
			<tomeg>500</tomeg>	
			<lejarat>2021.12.08</lejarat>
		</elelmiszer>
	</osszetevo>
	<osszetevo okod="6">
		<elelmiszer>
			<nev>bazsalikom</nev>
			<tipus>fűszer</tipus>
			<tomeg>50</tomeg>	
			<lejarat>2023.06.04</lejarat>
		</elelmiszer>
	</osszetevo>
</pizzazo>